{"baseline_rust_snapshot":"a97ce88454d2ab938e6f8892dcac861845302c09","registry_sha256":"f1c32dd47a87e26e978e1bf3bfdbc5e4992d3797680567905e9d50ea00708fd6","schema_version":2,"sources":{"core_services":{"path":"docs/research/CORE_ENGINE_SERVICES_MAP.md","sha256":"68a1bb011bf8281d31d90a49dc38d044c81e876a3599e3f886a00569d00b4607"},"inventory":{"path":"docs/research/GAMEMD_SYSTEM_INVENTORY_COVERAGE_MAP_GHIDRA_REPORT.md","sha256":"41354eb55cf83bc9246ed149f76036875ace79d6bc7b1a9ba2677586943f0cd9"},"status_matrix":{"path":"docs/research/GAMEMD_SYSTEM_STATUS_MATRIX_SYSTEM_MODEL_SYNTHESIS.md","sha256":"87cf115592a50d52f4b501806074b8415b05e7d930dc9104354c4b7e6d1f3a6c"}}}
